{
 "report_id": "DAILY_20261001",
 "report_type": "africa_daily",
 "title": "非洲地区社会安全与综合形势日报",
 "report_date": "2026-10-01",
 "period_start": "2026-09-30T20:06:35.512719",
 "period_end": "2026-10-01T20:06:35.512719",
 "generated_at": "2026-10-01T20:06:35.512719",
 "report_timezone": "Asia/Shanghai",
 "executive_summary": [
  {
   "item_id": "EVT_0d3d5f965af9d648",
   "master_event_id": null,
   "country_iso3": "CD?",
   "headline_zh": "RDC-Rwanda: à l'ONU, Kinshasa et Kigali exposent leurs griefs",
   "fact_summary": "刚果（金）与卢旺达在联合国安理会就解除武装、军事存在、停火及平民保护等问题各自提出指控。双方仍参与华盛顿进程，但分歧超出FDLR问题。刚果（金）指责卢旺达支持AFC-M23，卢旺达则指控刚果（金）军队继续与FDLR合作，刚果（金）对此予以否认。",
   "assessment": "该事实已通过确定性核验（来源/归因/不确定性见各字段）。",
   "outlook": "AI 研判见总体分析栏目；本条目不提供独立预测。",
   "verification_status": "single_source",
   "uncertainties": [
    "卢旺达提出的核查机制尚未宣布接受",
    "刚果（金）对卢旺达无人机袭击的指控有待核实",
    "信息来自单一来源（RFI）"
   ],
   "source_refs": [
    {
     "source_id": "RFI Afrique",
     "source_name": "RFI Afrique",
     "url": null
    }
   ],
   "latest_update_at": null,
   "importance_score": 50,
   "selection_reasons": [],
   "single_source_warning": true,
   "conflicting": false
  },
  {
   "item_id": "EVT_fedaea4e3cd05d48",
   "master_event_id": null,
   "country_iso3": "GH?",
   "headline_zh": "UG Pro-VC calls for stronger research funding to curb brain drain",
   "fact_summary": "加纳大学学术与学生事务副校长Gordon Akanzuwine Awandare教授呼吁对科学与研究进行更强有力且持续的投资。该呼吁旨在遏制人才外流。此消息为单一来源报道。",
   "assessment": "该事实已通过确定性核验（来源/归因/不确定性见各字段）。",
   "outlook": "AI 研判见总体分析栏目；本条目不提供独立预测。",
   "verification_status": "single_source",
   "uncertainties": [
    "该消息目前仅有一个来源（MyJoyOnline），尚缺乏交叉验证"
   ],
   "source_refs": [
    {
     "source_id": "MyJoyOnline",
     "source_name": "MyJoyOnline",
     "url": null
    }
   ],
   "latest_update_at": null,
   "importance_score": 50,
   "selection_reasons": [],
   "single_source_warning": true,
   "conflicting": false
  },
  {
   "item_id": "EVT_9071fae1f6a31873",
   "master_event_id": null,
   "country_iso3": "GH?",
   "headline_zh": "Woman in critical condition after shooting at funeral grounds in Yeji",
   "fact_summary": "加纳Bono East地区Pru East区Yeji郊区Tonka一处葬礼场地发生枪击事件，一名女子据称中枪后伤势危重。该消息目前为单一来源报道，事件细节尚未获得独立证实。",
   "assessment": "该事实已通过确定性核验（来源/归因/不确定性见各字段）。",
   "outlook": "AI 研判见总体分析栏目；本条目不提供独立预测。",
   "verification_status": "single_source",
   "uncertainties": [
    "女子中枪情节为据称（allegedly），尚未证实",
    "事件目前为单一来源报道，缺乏交叉验证",
    "枪击动机、嫌疑人及具体经过尚不明确"
   ],
   "source_refs": [
    {
     "source_id": "MyJoyOnline",
     "source_name": "MyJoyOnline",
     "url": null
    }
   ],
   "latest_update_at": null,
   "importance_score": 50,
   "selection_reasons": [],
   "single_source_warning": true,
   "conflicting": false
  },
  {
   "item_id": "EVT_6e442122b01a9f6e",
   "master_event_id": null,
   "country_iso3": "GH?",
   "headline_zh": "Breast Cancer awareness must lead to action – Deputy Health Minister",
   "fact_summary": "加纳卫生部副部长Grace Ayensu-Danquah教授呼吁抗击乳腺癌的利益相关方超越宣传活动，加强体系建设，使患者能够及时获得诊断和治疗。该消息由MyJoyOnline单一来源报道。",
   "assessment": "该事实已通过确定性核验（来源/归因/不确定性见各字段）。",
   "outlook": "AI 研判见总体分析栏目；本条目不提供独立预测。",
   "verification_status": "single_source",
   "uncertainties": [
    "该消息目前仅有一个来源（MyJoyOnline），尚缺乏交叉验证"
   ],
   "source_refs": [
    {
     "source_id": "MyJoyOnline",
     "source_name": "MyJoyOnline",
     "url": null
    }
   ],
   "latest_update_at": null,
   "importance_score": 50,
   "selection_reasons": [],
   "single_source_warning": true,
   "conflicting": false
  },
  {
   "item_id": "EVT_5f99d5c5035e8c4b",
   "master_event_id": null,
   "country_iso3": "GH?",
   "headline_zh": "UK identified as leading destination for Ghana’s illicit cannabis exports – Report",
   "fact_summary": "据《全球有组织犯罪指数》报告，英国已成为加纳非法大麻出口的主要目的地。报告还提及毒品资金据称资助加纳政党和房地产。该信息目前为单一来源报道。",
   "assessment": "该事实已通过确定性核验（来源/归因/不确定性见各字段）。",
   "outlook": "AI 研判见总体分析栏目；本条目不提供独立预测。",
   "verification_status": "single_source",
   "uncertainties": [
    "该报告结论目前仅有一个来源报道，尚缺乏交叉验证",
    "毒品资金资助政党与房地产的说法为据称，尚未证实"
   ],
   "source_refs": [
    {
     "source_id": "MyJoyOnline",
     "source_name": "MyJoyOnline",
     "url": null
    }
   ],
   "latest_update_at": null,
   "importance_score": 50,
   "selection_reasons": [],
   "single_source_warning": true,
   "conflicting": false
  },
  {
   "item_id": "EVT_347e956c5259ffbe",
   "master_event_id": null,
   "country_iso3": "GH?",
   "headline_zh": "Drug money allegedly finances Ghana’s political parties and real estate – Global Organised Crime Index",
   "fact_summary": "全球有组织犯罪指数指出，有指控称加纳毒品交易相关人员为政党提供资金，且与非法市场相关的资金助推了该国住房热潮。该信息目前为单一来源报道，相关指控尚未得到证实。",
   "assessment": "该事实已通过确定性核验（来源/归因/不确定性见各字段）。",
   "outlook": "AI 研判见总体分析栏目；本条目不提供独立预测。",
   "verification_status": "single_source",
   "uncertainties": [
    "毒品资金资助政党及房地产的说法仅为指控，尚未证实",
    "目前仅有一个来源报道，缺乏交叉验证"
   ],
   "source_refs": [
    {
     "source_id": "MyJoyOnline",
     "source_name": "MyJoyOnline",
     "url": null
    }
   ],
   "latest_update_at": null,
   "importance_score": 50,
   "selection_reasons": [],
   "single_source_warning": true,
   "conflicting": false
  },
  {
   "item_id": "EVT_d8049da4263e5acf",
   "master_event_id": null,
   "country_iso3": "GH?",
   "headline_zh": "NSA outlines seven steps for successful posting and validation of national service personnel",
   "fact_summary": "加纳国家服务局（NSA）公布了面向准国家服务人员（NSP）的七步流程，用于在正式开始国家服务前完成派遣与验证。该消息由单一来源MyJoyOnline报道。",
   "assessment": "该事实已通过确定性核验（来源/归因/不确定性见各字段）。",
   "outlook": "AI 研判见总体分析栏目；本条目不提供独立预测。",
   "verification_status": "single_source",
   "uncertainties": [
    "该消息目前仅有一个来源（MyJoyOnline），尚缺乏交叉验证"
   ],
   "source_refs": [
    {
     "source_id": "MyJoyOnline",
     "source_name": "MyJoyOnline",
     "url": null
    }
   ],
   "latest_update_at": null,
   "importance_score": 50,
   "selection_reasons": [],
   "single_source_warning": true,
   "conflicting": false
  },
  {
   "item_id": "EVT_ae5a6a64feca464f",
   "master_event_id": null,
   "country_iso3": "GH?",
   "headline_zh": "GPRTU taskforce clamps down on unapproved fares at Kasoa",
   "fact_summary": "加纳私人道路运输联盟（GPRTU）工作组在Kasoa加强对商业司机的监控，此前有投诉称部分司机向乘客收取超过批准的8%票价涨幅。该事件为单一来源报道。",
   "assessment": "该事实已通过确定性核验（来源/归因/不确定性见各字段）。",
   "outlook": "AI 研判见总体分析栏目；本条目不提供独立预测。",
   "verification_status": "single_source",
   "uncertainties": [
    "司机违规收费的投诉尚未获得独立证实",
    "该事件目前仅有一个来源报道"
   ],
   "source_refs": [
    {
     "source_id": "MyJoyOnline",
     "source_name": "MyJoyOnline",
     "url": null
    }
   ],
   "latest_update_at": null,
   "importance_score": 50,
   "selection_reasons": [],
   "single_source_warning": true,
   "conflicting": false
  },
  {
   "item_id": "EVT_ef07b3ff1309fad9",
   "master_event_id": null,
   "country_iso3": "GH?",
   "headline_zh": "Prime Insight: Making room for meaningful national conversations on Joy Prime",
   "fact_summary": "加纳媒体Joy Prime推出《Prime Insight》节目，旨在为全国性议题提供有意义的对话空间。节目关注民众日常关心的交通票价、电费及政治讨论等话题。该报道为单一来源，内容属媒体节目介绍，未涉及具体安全事件。",
   "assessment": "该事实已通过确定性核验（来源/归因/不确定性见各字段）。",
   "outlook": "AI 研判见总体分析栏目；本条目不提供独立预测。",
   "verification_status": "single_source",
   "uncertainties": [
    "该报道为单一来源，尚缺乏交叉验证"
   ],
   "source_refs": [
    {
     "source_id": "MyJoyOnline",
     "source_name": "MyJoyOnline",
     "url": null
    }
   ],
   "latest_update_at": null,
   "importance_score": 50,
   "selection_reasons": [],
   "single_source_warning": true,
   "conflicting": false
  },
  {
   "item_id": "EVT_45b32b1ec0ff31ab",
   "master_event_id": null,
   "country_iso3": "GH?",
   "headline_zh": "FABAG commends Ato Forson’s over removal of 20% excise duty on locally manufactured fruit juices",
   "fact_summary": "加纳工商会（FABAG）在与财政部长会面时，对Ato Forson决定取消本地生产果汁20%消费税表示赞赏。协会主席Rev. John Awuni称，成员对政府回应业界此前多次提出的关切感到满意。该消息为单一来源报道。",
   "assessment": "该事实已通过确定性核验（来源/归因/不确定性见各字段）。",
   "outlook": "AI 研判见总体分析栏目；本条目不提供独立预测。",
   "verification_status": "single_source",
   "uncertainties": [
    "该消息目前仅有一个来源（MyJoyOnline），尚缺乏交叉验证"
   ],
   "source_refs": [
    {
     "source_id": "MyJoyOnline",
     "source_name": "MyJoyOnline",
     "url": null
    }
   ],
   "latest_update_at": null,
   "importance_score": 50,
   "selection_reasons": [],
   "single_source_warning": true,
   "conflicting": false
  },
  {
   "item_id": "EVT_525a3e8495b9da5f",
   "master_event_id": null,
   "country_iso3": "GH?",
   "headline_zh": "HIV stigma discourages testing, prevention and treatment in Ghana – Ghana AIDS Commission",
   "fact_summary": "加纳艾滋病委员会（GAC）警告称，围绕HIV的污名化正在阻碍人们获取预防、检测、治疗和支持服务。委员会总干事Kharmacelle Prosper Akanbong博士表示，将HIV感染自动等同于滥交的误解持续影响着病毒携带者所受的对待。他称这类观念既不公正，也削弱了相关防治努力。",
   "assessment": "该事实已通过确定性核验（来源/归因/不确定性见各字段）。",
   "outlook": "AI 研判见总体分析栏目；本条目不提供独立预测。",
   "verification_status": "single_source",
   "uncertainties": [
    "目前仅一个来源（MyJoyOnline）报道，尚缺乏交叉验证"
   ],
   "source_refs": [
    {
     "source_id": "MyJoyOnline",
     "source_name": "MyJoyOnline",
     "url": null
    }
   ],
   "latest_update_at": null,
   "importance_score": 50,
   "selection_reasons": [],
   "single_source_warning": true,
   "conflicting": false
  },
  {
   "item_id": "EVT_d458c4c166cabd09",
   "master_event_id": null,
   "country_iso3": "GH?",
   "headline_zh": "Blocking cocaine probe lends weight to claims of political protection for traffickers – Assin South MP",
   "fact_summary": "加纳议会国防与内政委员会影子成员约翰·宁蒂姆·福德乔尔称，议长及全国民主大会党多数派否决设立特设委员会调查加纳可卡因贩运案，此举佐证了贩毒者享有政治庇护的说法。相关指控目前为单一来源，尚未获得独立证实。",
   "assessment": "该事实已通过确定性核验（来源/归因/不确定性见各字段）。",
   "outlook": "AI 研判见总体分析栏目；本条目不提供独立预测。",
   "verification_status": "single_source",
   "uncertainties": [
    "贩毒者享有政治庇护的说法尚未获得独立证实",
    "该事件目前仅有一个来源报道，缺乏交叉验证"
   ],
   "source_refs": [
    {
     "source_id": "MyJoyOnline",
     "source_name": "MyJoyOnline",
     "url": null
    }
   ],
   "latest_update_at": null,
   "importance_score": 50,
   "selection_reasons": [],
   "single_source_warning": true,
   "conflicting": false
  },
  {
   "item_id": "EVT_f3e5089501ba1109",
   "master_event_id": null,
   "country_iso3": "GH?",